{
  "id": "plan-great-wall",
  "concept_key": "concept:great-wall",
  "registry_status": "new",
  "term": "은하 장성",
  "notation": {
    "hanja": "銀河長城",
    "english": "great wall",
    "hanja_gloss": "銀 은 은 · 河 물 하 · 長 길 장 · 城 재 성"
  },
  "definition": "수많은 은하가 필라멘트보다 훨씬 두껍고 거대하게 벽처럼 늘어서 이룬 구조.",
  "definition_source": "restated",
  "relations": [
    {
      "id": "rel-gw-scale",
      "text": "규모로 보면 은하 집단보다 필라멘트가, 필라멘트보다 은하 장성이 크다.",
      "form": {
        "condition": "우주거대구조를 규모 순으로 늘어놓을 때",
        "type": "classification",
        "scope": "은하의 공간 분포 구조"
      },
      "invertible": true,
      "invertible_reason": "뒤집은 문장은 규모 차례를 거꾸로 놓은 것이라 은하 장성이 가장 큰 구조라는 서술과 어긋나 반드시 거짓이다.",
      "curriculum": [
        "12행우03-05"
      ],
      "verified_by": "pending",
      "inverted_text": "규모로 보면 은하 장성보다 필라멘트가, 필라멘트보다 은하 집단이 크다."
    },
    {
      "id": "rel-gw-vs-void",
      "text": "은하 장성은 은하가 빽빽이 몰린 곳이고 보이드는 은하가 거의 없는 곳이다.",
      "form": {
        "condition": "은하의 공간 분포에서 두 구조를 견줄 때",
        "type": "classification",
        "scope": "우주거대구조"
      },
      "invertible": true,
      "invertible_reason": "뒤집은 문장은 두 이름을 맞바꾼 것이라 각 정의와 정면으로 어긋나 반드시 거짓이다.",
      "curriculum": [
        "12행우03-05"
      ],
      "verified_by": "pending",
      "inverted_text": "은하 장성은 은하가 거의 없는 곳이고 보이드는 은하가 빽빽이 몰린 곳이다."
    }
  ],
  "misconceptions": [
    {
      "text": "은하 장성은 은하들이 실제로 벽처럼 이어 붙어 있는 하나의 천체다",
      "why_wrong": "낱낱의 은하가 큰 규모에서 벽처럼 늘어서 보이는 분포를 가리키는 말이지, 붙어 있는 한 천체가 아니다.",
      "source": "llm",
      "verified_by": "pending",
      "linked_relation": "rel-gw-vs-void"
    },
    {
      "text": "은하 장성은 필라멘트보다 작은 구조다",
      "why_wrong": "필라멘트보다 훨씬 두껍고 거대한 규모의 구조다.",
      "source": "llm",
      "verified_by": "pending",
      "linked_relation": "rel-gw-scale"
    }
  ],
  "links": [
    {
      "type": "next",
      "target": "plan-large-scale-structure"
    },
    {
      "type": "related",
      "target": "plan-cosmic-filament"
    }
  ],
  "media": [],
  "curriculum": [
    "12행우03-05"
  ],
  "subject": "행성우주과학",
  "unit": "Ⅲ. 은하와 우주",
  "unit_id": "plan-3",
  "topic_id": "plan-3-04-1",
  "pages": [
    115
  ],
  "difficulty": 3,
  "role": "core",
  "version": 1
}
