{
  "id": "chem-forward-reaction",
  "concept_key": "concept:forward-reaction",
  "registry_status": "new",
  "term": "정반응",
  "notation": {
    "hanja": "正反應",
    "hanja_gloss": "正 바를 정 · 反 돌이킬 반 · 應 응할 응",
    "english": "forward reaction"
  },
  "definition": "화학 반응식을 왼쪽 반응물·오른쪽 생성물로 적었을 때, 오른쪽을 향해 나아가는 쪽의 반응. 가역 반응에서 역반응과 짝을 이룬다.",
  "definition_source": "restated",
  "relations": [
    {
      "id": "rel-fwd-classify",
      "text": "반응물이 줄고 생성물이 늘어나는 쪽으로 나아가는 반응을 정반응으로 가른다.",
      "form": {
        "condition": "화학 반응식의 왼쪽을 반응물, 오른쪽을 생성물로 적었을 때",
        "type": "classification",
        "scope": "정반응과 역반응을 함께 정의하는 가역 반응",
        "antecedent": {
          "quantity": "반응물의 양",
          "direction": "감소"
        },
        "consequent": {
          "quantity": "생성물의 양",
          "direction": "증가"
        }
      },
      "invertible": true,
      "invertible_reason": "생성물이 줄고 반응물이 늘어나는 쪽은 역반응의 규정이므로 반드시 거짓이다.",
      "curriculum": [
        "12화학03-01"
      ],
      "verified_by": "teacher",
      "inverted_text": "생성물이 줄고 반응물이 늘어나는 쪽으로 나아가는 반응을 정반응으로 가른다."
    },
    {
      "id": "rel-fwd-not-stopped",
      "text": "평형에 이른 뒤에도 정반응은 멈추지 않고 역반응과 같은 빠르기로 계속 일어난다.",
      "form": {
        "condition": "닫힌 용기에서 충분한 시간이 지나 평형에 닿았을 때",
        "type": "conditional",
        "scope": "밀폐된 계에서 일어나는 가역 반응"
      },
      "invertible": true,
      "invertible_reason": "평형에서 한쪽만 멈춘다면 농도가 계속 달라져 평형일 수 없으므로 반드시 거짓이다.",
      "curriculum": [
        "12화학03-01"
      ],
      "verified_by": "teacher",
      "inverted_text": "평형에 이르면 정반응은 멈추고 역반응만 계속 일어난다."
    },
    {
      "id": "rel-fwd-k-large",
      "text": "같은 온도에서 평형 상수가 1보다 훨씬 크면 정반응이 우세한 반응으로 읽는다.",
      "form": {
        "condition": "온도를 고정한 채 평형 상수의 크기를 볼 때",
        "type": "conditional",
        "scope": "평형 상수로 우세한 쪽을 가늠하는 가역 반응"
      },
      "invertible": true,
      "invertible_reason": "평형 상수가 1보다 훨씬 크다는 것은 생성물 쪽이 많다는 뜻이라 역반응 우세로 읽는 것은 반드시 거짓이다.",
      "curriculum": [
        "12화학03-01",
        "12화학03-02"
      ],
      "verified_by": "teacher",
      "inverted_text": "같은 온도에서 평형 상수가 1보다 훨씬 크면 역반응이 우세한 반응으로 읽는다."
    }
  ],
  "misconceptions": [
    {
      "text": "평형에 도달하면 정반응은 끝나고 더 이상 일어나지 않는다",
      "why_wrong": "평형은 반응이 끝난 상태가 아니다. 정반응은 그대로 일어나되 역반응과 빠르기가 같아져서 겉보기 양만 변하지 않는 것이다.",
      "source": "llm",
      "verified_by": "teacher",
      "linked_relation": "rel-fwd-not-stopped"
    },
    {
      "text": "정반응은 언제나 역반응보다 빠르다",
      "why_wrong": "평형에 닿기 전에는 그럴 수 있지만, 평형에서는 두 빠르기가 같아진다. 생성물만 넣고 시작하면 오히려 역반응이 더 빠른 구간도 있다.",
      "source": "llm",
      "verified_by": "teacher",
      "linked_relation": "rel-fwd-not-stopped"
    }
  ],
  "links": [
    {
      "type": "next",
      "target": "chem-reversible-reaction",
      "note": "정반응과 역반응의 뜻을 알아야 '둘 다 일어나는 반응'을 읽는다"
    },
    {
      "type": "related",
      "target": "chem-reverse-reaction",
      "note": "방향이 정반대인 짝"
    },
    {
      "type": "related",
      "target": "chem-equilibrium-constant",
      "note": "K의 크기로 어느 쪽이 우세한지 가늠한다"
    }
  ],
  "media": [],
  "curriculum": [
    "12화학03-01"
  ],
  "subject": "화학",
  "unit": "Ⅲ. 화학 평형",
  "unit_id": "chem-3",
  "topic_id": "chem-3-1-01",
  "pages": [
    107,
    113,
    117
  ],
  "difficulty": 1,
  "role": "supporting",
  "version": 1,
  "quiz_ready": true
}
