{
 "id": "esys-upper-divergence-and-cyclogenesis",
 "concept_key": "concept:upper-level-divergence-and-surface-pressure-system",
 "registry_status": "new",
 "term": "상층 발산·수렴과 지상 기압계의 발달",
 "notation": {
  "hanja": "上層發散收斂 地上氣壓系發達",
  "english": "upper-level divergence and surface pressure system development"
 },
 "definition": "편서풍 파동의 풍속 차가 만든 상층의 발산·수렴이 하층의 수렴·발산과 연직 운동을 이끌어 지상 고·저기압을 키우는 과정.",
 "definition_source": "restated",
 "relations": [
  {
   "id": "rel-udc-trough-east",
   "text": "편서풍 파동 기압골의 동쪽에서는 상층 발산이 일어나 하층 수렴과 상승 운동을 이끌어 지상 저기압이 발달한다.",
   "form": {
    "condition": "상층에서 풍속 차로 발산이 생길 때",
    "type": "causal",
    "scope": "북반구 중위도"
   },
   "invertible": true,
   "invertible_reason": "뒤집은 문장 「기압골 동쪽에서 상층 발산이 일어나 지상 고기압이 발달한다」는 발산이 상승과 저기압을 부른다는 점과 어긋나 참이 될 경우가 없다.",
   "inverted_text": "편서풍 파동 기압골의 동쪽에서는 상층 발산이 일어나 지상 고기압이 발달한다.",
   "curriculum": [
    "12지시03-06"
   ],
   "verified_by": "pending"
  },
  {
   "id": "rel-udc-trough-west",
   "text": "편서풍 파동 기압골의 서쪽에서는 상층 수렴이 활발해져 하강 운동이 유도되고 지상 고기압이 발달한다.",
   "form": {
    "condition": "상층에서 풍속 차로 수렴이 생길 때",
    "type": "causal",
    "scope": "북반구 중위도"
   },
   "invertible": true,
   "invertible_reason": "뒤집은 문장 「기압골 서쪽에서 상층 수렴이 활발해져 지상 저기압이 발달한다」는 수렴이 하강과 고기압을 부른다는 점과 어긋나 참이 될 경우가 없다.",
   "inverted_text": "편서풍 파동 기압골의 서쪽에서는 상층 수렴이 활발해져 지상 저기압이 발달한다.",
   "curriculum": [
    "12지시03-06"
   ],
   "verified_by": "pending"
  }
 ],
 "misconceptions": [
  {
   "text": "지상 저기압은 상층 기압골 바로 아래에서 발달한다.",
   "why_wrong": "상층 발산이 일어나는 곳은 기압골의 동쪽이다. 지상 저기압도 그쪽에서 발달한다.",
   "source": "llm",
   "verified_by": "pending",
   "linked_relation": "rel-udc-trough-east"
  },
  {
   "text": "상층의 바람 흐름은 지상 날씨와 상관이 없다.",
   "why_wrong": "상층의 발산과 수렴이 하층의 수렴·발산과 연직 운동을 이끌어 지상 기압계를 키운다.",
   "source": "llm",
   "verified_by": "pending",
   "linked_relation": "rel-udc-trough-east"
  }
 ],
 "links": [
  {
   "type": "prereq",
   "target": "esys-trough-and-ridge"
  },
  {
   "type": "prereq",
   "target": "esys-rossby-wave"
  },
  {
   "type": "prereq",
   "target": "esys-convergence-divergence"
  },
  {
   "type": "next",
   "target": "esys-rossby-wave-and-weather"
  }
 ],
 "media": [],
 "curriculum": [
  "12지시03-06"
 ],
 "subject": "지구시스템과학",
 "unit": "Ⅲ. 강수 과정과 대기의 운동",
 "unit_id": "esys-3",
 "topic_id": "esys-3-04-2",
 "pages": [
  122
 ],
 "difficulty": 5,
 "role": "core",
 "version": 1,
 "homonym_flag": true,
 "notes": [
  "표제어에 '계'(氣壓系)가 들어가 homonyms.yaml 의 감시어와 겹친다. 접미사로 쓰인 것이라 동음이의 개념으로 잡지 않았다 (R9).",
  "C6 결함 수정 — rel-udc-coupling 은 definition 을 문장으로 편 동어반복이었고, 판별 내용은 rel-udc-trough-east·rel-udc-trough-west 가 이미 담고 있어 접었다. 거기 걸려 있던 오개념 「상층의 바람 흐름은 지상 날씨와 상관이 없다」는 rel-udc-trough-east 로 옮겨 걸었다."
 ]
}
