{
  "subject": "생명과학",
  "unit": "Ⅱ. 항상성과 몸의 조절",
  "unit_id": "bio-2",
  "version": 1,
  "definition_source": "restated",
  "id": "bio-virus",
  "concept_key": "concept:virus",
  "registry_status": "new",
  "term": "바이러스",
  "notation": {
    "hanja": "해당 없음",
    "hanja_note": "영어 virus 를 소리대로 옮긴 말이라 대응하는 한자어가 없다",
    "english": "virus"
  },
  "definition": "핵산을 단백질 껍질이 감싼 모습으로만 존재하는 병원체. 세포의 짜임을 갖추지 못해 숙주세포 안에서만 늘어날 수 있다.",
  "relations": [
    {
      "id": "rel-vir-structure",
      "text": "바이러스는 세포의 구조 없이 핵산과 그 겉을 싼 단백질 껍질로만 이루어져 있다",
      "form": {
        "condition": "바이러스의 짜임을 볼 때",
        "type": "classification",
        "scope": "바이러스"
      },
      "invertible": false,
      "invertible_reason": "짜임을 밝힌 서술이라 맞바꿀 두 양이 없다",
      "curriculum": [
        "12생과02-05"
      ],
      "verified_by": "pending"
    },
    {
      "id": "rel-vir-vs-bacterium",
      "text": "바이러스는 스스로 물질대사를 하지 못해 숙주세포 안에서만 늘어나고, 세균은 스스로 물질대사를 하며 분열로 늘어난다",
      "form": {
        "condition": "두 병원체의 증식 방식을 견줄 때",
        "type": "classification",
        "scope": "바이러스와 세균"
      },
      "invertible": true,
      "invertible_reason": "증식 방식이 정해져 있어 맞바꾸면 반드시 거짓이다",
      "curriculum": [
        "12생과02-05"
      ],
      "verified_by": "pending",
      "inverted_text": "세균은 스스로 물질대사를 하지 못해 숙주세포 안에서만 늘어나고, 바이러스는 스스로 물질대사를 하며 분열로 늘어난다"
    },
    {
      "id": "rel-vir-damage",
      "text": "숙주세포 안에서 늘어나는 동안 그 세포를 상하게 하거나 부수어 질병을 일으킨다",
      "form": {
        "condition": "바이러스가 숙주세포에 들어간 뒤",
        "type": "causal",
        "scope": "바이러스성 질병"
      },
      "invertible": false,
      "invertible_reason": "병이 생기는 까닭을 밝힌 서술이라 뒤집을 방향이 없다",
      "curriculum": [
        "12생과02-05"
      ],
      "verified_by": "pending"
    },
    {
      "id": "rel-vir-prevent",
      "text": "항바이러스제는 만들기 어렵고 종류도 많지 않아 바이러스성 질병은 예방이 더 중요하다",
      "form": {
        "condition": "바이러스성 질병을 다룰 때",
        "type": "causal",
        "scope": "바이러스성 질병의 치료와 예방"
      },
      "invertible": false,
      "invertible_reason": "치료의 한계에서 나온 결론이라 맞바꿀 두 양이 없다",
      "curriculum": [
        "12생과02-05"
      ],
      "verified_by": "pending"
    }
  ],
  "misconceptions": [
    {
      "text": "바이러스는 세포분열을 하며 스스로 늘어난다",
      "why_wrong": "세포 구조가 없어 스스로 늘지 못하고 숙주세포 안에서만 증식한다.",
      "source": "llm",
      "verified_by": "pending",
      "linked_relation": "rel-vir-vs-bacterium"
    },
    {
      "text": "바이러스가 일으킨 병에도 항생제가 잘 듣는다",
      "why_wrong": "항생제는 세균에 듣는 약이다. 바이러스에는 항바이러스제를 쓴다.",
      "source": "llm",
      "verified_by": "pending",
      "linked_relation": "rel-vir-prevent"
    }
  ],
  "links": [
    {
      "type": "prereq",
      "target": "bio-pathogen"
    },
    {
      "type": "related",
      "target": "bio-bacterium",
      "note": "구조와 증식 방식을 나란히 놓고 견준다"
    },
    {
      "type": "related",
      "target": "bio-vaccine-principle",
      "note": "항원 구조가 잘 바뀌어 백신을 만들기 어려운 까닭을 본다"
    }
  ],
  "curriculum": [
    "12생과02-05"
  ],
  "topic_id": "bio-2-4-2",
  "pages": [
    100,
    107,
    123
  ],
  "difficulty": 3,
  "role": "supporting",
  "media": [],
  "homonym_flag": false
}
